{
  "bundle_id": "example-bundle-2026-04-08-001",
  "project_id": "clixsy-oracle-agent",
  "created_at": "2026-04-08T18:00:00Z",
  "subject": "Synthetic example bundle for evidence contract demonstration only",
  "sources": [
    {
      "source_id": "src-001",
      "kind": "repo_file",
      "origin": "README.md",
      "retrieved_at": "2026-04-08T17:45:00Z",
      "provenance_note": "Example repo document used as synthetic source input."
    },
    {
      "source_id": "src-002",
      "kind": "repo_file",
      "origin": "ai_context/30_CURRENT_STATE.md",
      "retrieved_at": "2026-04-08T17:46:00Z"
    }
  ],
  "findings": [
    {
      "finding_id": "fnd-001",
      "statement": "The repository is currently documentation-forward and intentionally sparse in committed implementation code.",
      "source_ids": [
        "src-001",
        "src-002"
      ]
    }
  ],
  "inferences": [
    {
      "inference_id": "inf-001",
      "statement": "Early product work should prioritize stable contracts and evidence traceability before runtime-specific build assumptions.",
      "basis_source_ids": [
        "src-001",
        "src-002"
      ],
      "assumption_note": "Interpretive planning direction, not a direct source fact."
    }
  ],
  "unknowns": [
    {
      "unknown_id": "unk-001",
      "question_or_gap": "Which runtime stack will produce and consume evidence bundles first?",
      "reason": "No committed runtime implementation details establish this yet."
    }
  ],
  "confidence": {
    "level": "medium",
    "rationale": "Grounded in current committed docs, but forward-looking inference remains provisional."
  },
  "freshness_note": "This is a synthetic example for contract shape illustration only and is not client or production evidence.",
  "related_files": [
    "contracts/EVIDENCE_BUNDLE_SPEC.md",
    "contracts/evidence_bundle.schema.json"
  ],
  "notes": "All values are placeholders for demonstration."
}
